{
  "app_id": "sazwW",
  "api_token": "13f327e891ad45858949004eb755b9f1",
  "ndk_enabled": true,
  "sdk_config": {
    "crash_handler": {
      "enabled": true
    },
    "networking": {
      "capture_request_content_length": false,
      "url_redaction_patterns": [
        "https://example.com/(secret)"
      ]
    },
    "taps": {
      "capture_coordinates": false
    }
  }
}
